,idc_link,course_titles,coupon_links,coupon_url,timestamps
0,https://courses.impodays.com/courses/,Advanced Certificate in Business & Marketing Strategy - Free Online Courses with Certificates,https://courses.impodays.com/advanced-certificate-in-business-marketing-strategy/,https://www.udemy.com/course/advanced-certificate-in-business-marketing-strategy/?couponCode=8EE2A187AE22C07C5D79,2025-05-10 15:45:53.255390
1,https://courses.impodays.com/courses/,AI-Powered Product Marketing and Market Research - Free Online Courses with Certificates,https://courses.impodays.com/ai-powered-product-marketing-and-market-research/,https://www.udemy.com/course/ai-powered-product-marketing-and-market-research/?couponCode=3113612AFD92B2818230,2025-05-10 15:45:54.766103
2,https://courses.impodays.com/courses/,Microsoft Office Specialist: Microsoft Excel Advanced Expert - Free Online Courses with Certificates,https://courses.impodays.com/microsoft-office-specialist-microsoft-excel-advanced-expert/,https://www.udemy.com/course/microsoft-office-specialist-microsoft-excel-advanced-expert/?couponCode=7C14C378CEFE8C505897,2025-05-10 15:45:56.579669
3,https://courses.impodays.com/courses/,Python For Data Science - Real Time Experience - Free Online Courses with Certificates,https://courses.impodays.com/python-for-data-science-real-time-exercises/,https://www.udemy.com/course/python-for-data-science-real-time-exercises/?couponCode=PYTHON_FREE_MAY9,2025-05-10 15:45:58.341475
4,https://courses.impodays.com/courses/,Data Science & Data Analytics Real World Projects - Free Online Courses with Certificates,https://courses.impodays.com/python-data-analytics-real-world-hands-on-projects/,https://www.udemy.com/course/bigdata-analysis-python/?couponCode=PROJECT_FREE_MAY9,2025-05-10 15:46:00.457322
5,https://courses.impodays.com/courses/,"Full Digital Marketing Course 2025: SEO, Paid Ad, GA4, GTM - Free Online Courses with Certificates",https://courses.impodays.com/full-digital-marketing-course-seo-paid-ad-ga4-gtm-email/,https://www.udemy.com/course/full-digital-marketing-course-seo-paid-ad-ga4-gtm-email/?couponCode=41FFADBBAC380E6C9BE6,2025-05-10 15:46:02.613618
6,https://courses.impodays.com/courses/,Data Science Career Path - Free Online Courses with Certificates,https://courses.impodays.com/data-science-career-path/,https://www.udemy.com/course/data-science-learning/?couponCode=6B6EA9B40CFD98A5868F,2025-05-10 15:46:04.481874
7,https://courses.impodays.com/courses/,Financial Modeling Course - Free Online Courses with Certificates,https://courses.impodays.com/financial-modeling-course/,https://www.udemy.com/course/financial-modeling-online-course/?couponCode=80307256A97804455E95,2025-05-10 15:46:06.307091
8,https://courses.impodays.com/courses/,Entrepreneurship and Business Research in Biomedical - Free Online Courses with Certificates,https://courses.impodays.com/entrepreneurship-and-business-research-in-biomedical/,https://www.udemy.com/course/entrepreneurship-and-business-research-in-biomedical/?couponCode=4331D146584E35E4D12E,2025-05-10 15:46:08.615207
9,https://courses.impodays.com/courses/,Big Data Hadoop Course - Free Online Courses with Certificates,https://courses.impodays.com/big-data-hadoop-course/,https://www.udemy.com/course/big-data-hadoop-online-course/?couponCode=BD5EF32431F16FE27F4F,2025-05-10 15:46:10.169950
10,https://courses.impodays.com/courses/,Mastering iOS Development - Free Online Courses with Certificates,https://courses.impodays.com/mastering-ios-development/,https://www.udemy.com/course/mastering-ios-development/?couponCode=187F5965D4ABE6A9D0D9,2025-05-10 15:46:11.961922
11,https://courses.impodays.com/courses/,Professional Certificate in DevOps - Free Online Courses with Certificates,https://courses.impodays.com/professional-certificate-in-devops/,https://www.udemy.com/course/professional-certificate-in-devops/?couponCode=9DD6A7D845AABF9549C0,2025-05-10 15:46:13.854158
12,https://courses.impodays.com/courses/,Complete Agentic AI Bootcamp With LangGraph and Langchain - Free Online Courses with Certificates,https://courses.impodays.com/complete-agentic-ai-bootcamp-with-langgraph-and-langchain/,https://www.udemy.com/course/complete-agentic-ai-bootcamp-with-langgraph-and-langchain/?couponCode=75B4CE0A6DEFC06D58E8,2025-05-10 15:46:15.482138
13,https://courses.impodays.com/courses/,JavaScript 10 Projects in 10 Days Course for Beginners - Free Online Courses with Certificates,https://courses.impodays.com/javascript-10-projects-in-10-days-course-for-beginners-2/,https://www.udemy.com/course/javascript-10-projects-in-10-days-course-for-beginners-w/?couponCode=79CC4D042DFC69C50B94,2025-05-10 15:46:17.263219
14,https://courses.impodays.com/courses/,"Lean & Quality Management, Six Sigma, Continuous Improvement - Free Online Courses with Certificates",https://courses.impodays.com/lean-quality-management-six-sigma-continuous-improvement/,https://www.udemy.com/course/lean-quality-management-six-sigma-continuous-improvement/?couponCode=8DA723B98154A165069B,2025-05-10 15:46:18.832952
15,https://courses.impodays.com/courses/,"Project Management Methodologies: Agile, Scrum, and PMP - Free Online Courses with Certificates",https://courses.impodays.com/project-management-methodologies-agile-scrum-and-pmp/,https://www.udemy.com/course/project-management-methodologies-agile-scrum-and-pmp/?couponCode=EC3EC2C3684EAE844088,2025-05-10 15:46:20.423834
16,https://courses.impodays.com/courses/page/2/,Professional Certificate in SQL and SQL for Data Analysis - Free Online Courses with Certificates,https://courses.impodays.com/professional-certificate-in-sql-and-sql-for-data-analysis/,https://www.udemy.com/course/professional-certificate-in-sql-and-sql-for-data-analysis/?couponCode=4B2B28C7FE4BCBEB80E1,2025-05-10 15:46:23.353669
17,https://courses.impodays.com/courses/page/2/,Build AI Call Assistants: AI Automation Agency with No-Code - Free Online Courses with Certificates,https://courses.impodays.com/build-ai-call-assistants-ai-automation-agency-with-no-code/,https://www.udemy.com/course/build-ai-call-assistants-ai-automation-agency-with-no-code/?couponCode=32A35C03F066615F0D6C,2025-05-10 15:46:25.269243
18,https://courses.impodays.com/courses/page/2/,AI Sales Prospecting: Automate Outreach at Scale with AI - Free Online Courses with Certificates,https://courses.impodays.com/ai-sales-prospecting-automate-outreach-at-scale-with-ai/,https://www.udemy.com/course/ai-sales-prospecting-automate-outreach-at-scale-with-ai/?couponCode=58EAD5B412B8834BC9AA,2025-05-10 15:46:27.069020
19,https://courses.impodays.com/courses/page/2/,Master AI Voice Agents: Automate Calls with AI and No-Code - Free Online Courses with Certificates,https://courses.impodays.com/master-ai-voice-agents-automate-calls-with-ai-and-no-code/,https://www.udemy.com/course/master-ai-voice-agents-automate-calls-with-ai-and-no-code/?couponCode=B18E3FE1603D58762E26,2025-05-10 15:46:28.606954
20,https://courses.impodays.com/courses/page/2/,Cold Email Mastery with AI: Ultimate Lead Generation System - Free Online Courses with Certificates,https://courses.impodays.com/cold-email-mastery-with-ai-ultimate-lead-generation-system/,https://www.udemy.com/course/cold-email-mastery-with-ai-ultimate-lead-generation-system/?couponCode=DANIALMIR,2025-05-10 15:46:30.385189
21,https://courses.impodays.com/courses/page/2/,"Data Quality, Data Management & Data Governance Certificate - Free Online Courses with Certificates",https://courses.impodays.com/data-quality-data-management-data-governance-certificate/,https://www.udemy.com/course/data-quality-data-management-data-governance-certificate/?couponCode=B9BEB49FC4AF8254D2E0,2025-05-10 15:46:32.097932
22,https://courses.impodays.com/courses/page/2/,Advanced Certificate in Program and Project Management - Free Online Courses with Certificates,https://courses.impodays.com/advanced-certificate-in-program-and-project-management/,https://www.udemy.com/course/advanced-certificate-in-program-and-project-management/?couponCode=28AACEA3CEDC5E920AA2,2025-05-10 15:46:33.768459
23,https://courses.impodays.com/courses/page/2/,Professional Diploma in Program Management - Free Online Courses with Certificates,https://courses.impodays.com/professional-diploma-in-program-management/,https://www.udemy.com/course/professional-diploma-in-program-management/?couponCode=6C4BBC482D895A818C14,2025-05-10 15:46:35.578492
24,https://courses.impodays.com/courses/page/2/,From Zero to Pro Data Science & AI Advanced Full Course 2025 - Free Online Courses with Certificates,https://courses.impodays.com/data-science-mastery-complete-data-science-bootcamp-2025/,https://www.udemy.com/course/data-science-mastery-complete-data-science-bootcamp-2025/?referralCode=408994D50F83E213E05F&couponCode=MAY2025BB,2025-05-10 15:46:37.384606
25,https://courses.impodays.com/courses/page/2/,AI Engineering Masterclass: From Zero to AI Hero - Free Online Courses with Certificates,https://courses.impodays.com/ai-engineering-masterclass-from-zero-to-ai-hero/,https://www.udemy.com/course/ai-engineering-masterclass-from-zero-to-ai-hero/?referralCode=339B4E16FB07E6F0EB09&couponCode=MAY2025BB,2025-05-10 15:46:39.579632
26,https://courses.impodays.com/courses/page/2/,The fastest way to become a product manager - Free Online Courses with Certificates,https://courses.impodays.com/discover-the-fastest-way-to-become-a-product-manager/,https://www.udemy.com/course/the-fastest-way-to-become-a-product-manager/?couponCode=RAMINSAMSON,2025-05-10 15:46:41.417697
27,https://courses.impodays.com/courses/page/2/,Advanced Power BI: Expert Data Analysis and Visualization - Free Online Courses with Certificates,https://courses.impodays.com/advanced-power-bi-expert-data-analysis-and-visualization/,https://www.udemy.com/course/advanced-power-bi-expert-data-analysis-and-visualization/?couponCode=018D54C6E3BB19B0AF8A,2025-05-10 15:46:43.261075
28,https://courses.impodays.com/courses/page/2/,AZ-900: Azure Fundamentals Complete Training - Free Online Courses with Certificates,https://courses.impodays.com/az-900-exam-prep-mastering-azure-fundamentals/,https://www.udemy.com/course/mastering-azure-fundamentals/?couponCode=1EB1D52A5359FBA42065,2025-05-10 15:46:44.822890
29,https://courses.impodays.com/courses/page/2/,Product Marketing: Go to Market Strategy - Free Online Courses with Certificates,https://courses.impodays.com/product-marketing-go-to-market-strategy/,https://www.udemy.com/course/product-marketing-and-development-go-to-market-strategy/?couponCode=EC84B6DCC1A7AD036411,2025-05-10 15:46:46.527319
30,https://courses.impodays.com/courses/page/2/,Data Analyst: Professional Certificate in Data Analysis - Free Online Courses with Certificates,https://courses.impodays.com/data-analyst-professional-certificate-in-data-analysis/,https://www.udemy.com/course/data-analyst-professional-certificate-in-data-analysis/?couponCode=3D067B179B97901852E3,2025-05-10 15:46:48.408309
31,https://courses.impodays.com/courses/page/2/,Build a Backend REST API with Node JS from Scratch - Free Online Courses with Certificates,https://courses.impodays.com/build-a-backend-rest-api-with-node-js-from-scratch/,https://www.udemy.com/course/build-backend-api-node-js-and-react-frontend/?couponCode=9D53E465D303DA077A63,2025-05-10 15:46:50.334190
,idc_link,course_titles,coupon_links,coupon_url,timestamps
0,https://courses.impodays.com/courses/,Microsoft Excel Data Analysis: Become a Data Analysis Expert - Free Online Courses with Certificates,https://courses.impodays.com/microsoft-excel-data-analysis-become-a-data-analysis-expert/,https://www.udemy.com/course/microsoft-excel-data-analysis-become-a-data-analysis-expert/?couponCode=3BA59C59ED8DCF5193C0,2025-05-28 18:52:39.952115
1,https://courses.impodays.com/courses/,Investor Pitching: Presentations for Startup Capital - Free Online Courses with Certificates,https://courses.impodays.com/investor-pitching-presentations-for-startup-capital/,https://www.udemy.com/course/how-to-make-an-investor-pitch-presentation/?couponCode=3325F4D0A3D993DF8EB0,2025-05-28 18:52:41.668271
2,https://courses.impodays.com/courses/,"GIT, GitLab, GitHub Fundamentals for Software Developers - Free Online Courses with Certificates",https://courses.impodays.com/git-gitlab-github-fundamentals-for-software-developers/,https://www.udemy.com/course/git-gitlab-github-fundamentals-for-software-developers/?couponCode=65EB2ACECA1AC4306C4B,2025-05-28 18:52:43.394974
3,https://courses.impodays.com/courses/,HR Business Acumen: Master Finance & Business Strategy - Free Online Courses with Certificates,https://courses.impodays.com/hr-business-acumen-master-finance-business-strategy/,https://www.udemy.com/course/hr-business-acumen-master-finance-business-strategy/?couponCode=MAY04_6613109&rand=349218239,2025-05-28 18:52:45.197632
4,https://courses.impodays.com/courses/,Complete Freelance MBA 2025: Digitalize Service Businesses - Free Online Courses with Certificates,https://courses.impodays.com/complete-freelance-mba-2024-digitalize-service-businesses/,https://www.udemy.com/course/complete-freelance-mba-2024-digitalize-service-businesses/?couponCode=28MAY2025,2025-05-28 18:52:46.888035
5,https://courses.impodays.com/courses/,Master Lead Generation: Grow Subscribers & Sales with Popups - Free Online Courses with Certificates,https://courses.impodays.com/master-lead-generation-grow-subscribers-sales-with-popups/,https://www.udemy.com/course/master-lead-generation-grow-subscribers-sales-with-popups/?couponCode=28MAY2025,2025-05-28 18:52:48.618114
6,https://courses.impodays.com/courses/,Mastering AWS Serverless: Hands-On with Core AWS Services - Free Online Courses with Certificates,https://courses.impodays.com/mastering-aws-serverless-hands-on-with-core-aws-services/,https://www.udemy.com/course/mastering-aws-serverless-hands-on-with-core-aws-services/?couponCode=28MAY2025,2025-05-28 18:52:50.450743
7,https://courses.impodays.com/courses/,AI-Powered Email Marketing: A Complete Guide - Free Online Courses with Certificates,https://courses.impodays.com/ai-powered-email-marketing-a-complete-guide/,https://www.udemy.com/course/ai-powered-email-marketing-a-complete-guide/?couponCode=28MAY2025,2025-05-28 18:52:52.309924
8,https://courses.impodays.com/courses/,Webflow for Beginners: Create Your First Website - Free Online Courses with Certificates,https://courses.impodays.com/webflow-for-beginners-create-your-first-website/,https://www.udemy.com/course/webflow-for-beginners-create-your-first-website/?couponCode=86D7B58C25A545ACC09D,2025-05-28 18:52:54.290421
9,https://courses.impodays.com/courses/,Advanced Adobe After Effects: Become VFX & Motion Expert - Free Online Courses with Certificates,https://courses.impodays.com/advanced-adobe-after-effects-become-vfx-motion-expert/,https://www.udemy.com/course/advanced-adobe-after-effects-become-vfx-motion-expert/?couponCode=0554E4A6F594E57F34FA,2025-05-28 18:52:56.047766
10,https://courses.impodays.com/courses/,Advanced Adobe Premiere Pro Add Hollywood-level Effects - Free Online Courses with Certificates,https://courses.impodays.com/advanced-adobe-premiere-pro-add-hollywood-level-effects/,https://www.udemy.com/course/advanced-adobe-premiere-pro-add-hollywood-level-effects/?couponCode=E0E259C53F1CEF3D5667,2025-05-28 18:52:58.232936
11,https://courses.impodays.com/courses/,Learn Bar Bending Schedule in AutoCAD & Excel - Free Online Courses with Certificates,https://courses.impodays.com/learn-bar-bending-schedule-in-autocad-excel/,https://www.udemy.com/course/learn-bar-bending-schedule-in-autocad-excel/?couponCode=MAYMONTHCOUPONS,2025-05-28 18:53:00.204154
12,https://courses.impodays.com/courses/,Mastering Revit - By Projects - Free Online Courses with Certificates,https://courses.impodays.com/revit-arch-modeling-rendering-interior-office-project/,https://www.udemy.com/course/modeling-rending-interior-office-project-in-revit/?couponCode=MAYMONTHCOUPONS,2025-05-28 18:53:01.960775
13,https://courses.impodays.com/courses/,Master Python Visually: A Complete A-Z Bootcamp for Beginner - Free Online Courses with Certificates,https://courses.impodays.com/master-python-visually-a-complete-a-z-bootcamp-for-beginner/,https://www.udemy.com/course/python-programming-course-for-beginners-and-non-it-student/?couponCode=MAY100OFF,2025-05-28 18:53:03.710017
14,https://courses.impodays.com/courses/,Python Programming: Build and Deploy Your Own Applications. - Free Online Courses with Certificates,https://courses.impodays.com/python-programming-build-and-deploy-your-own-applications/,https://www.udemy.com/course/python-programming-build-and-deploy-your-own-applications/?couponCode=1606803B8B4F8385C0D4,2025-05-28 18:53:05.412995
15,https://courses.impodays.com/courses/,MongoDB - The Complete MongoDB Developers Course - Free Online Courses with Certificates,https://courses.impodays.com/mongodb-the-complete-mongodb-developers-course/,https://www.udemy.com/course/mongodb-the-complete-mongodb-developers-course/?couponCode=965CD55D071F70F5F29F,2025-05-28 18:53:07.136758
16,https://courses.impodays.com/courses/page/2/,NumPy Programming Mastery: Learn Python for Data Analysis - Free Online Courses with Certificates,https://courses.impodays.com/numpy-programming-mastery-learn-python-for-data-analysis/,https://www.udemy.com/course/numpy-programming-mastery-learn-python-for-data-analysis/?couponCode=304D97E63D6FCFAB0996,2025-05-28 18:53:10.469964
17,https://courses.impodays.com/courses/page/2/,Professional Business Management Certificate - Free Online Courses with Certificates,https://courses.impodays.com/professional-business-management-certificate/,https://www.udemy.com/course/professional-business-management-certificate/?couponCode=64F12B1E5B68F7CBADD0,2025-05-28 18:53:12.162182
18,https://courses.impodays.com/courses/page/2/,"Global Wealth Management: Account Opening, Onboarding, KYC - Free Online Courses with Certificates",https://courses.impodays.com/global-wealth-management-account-opening-onboarding-kyc/,https://www.udemy.com/course/global-wealth-management-account-opening-onboarding-kyc/?couponCode=A3680FD9C36665BA59E5,2025-05-28 18:53:13.895128
19,https://courses.impodays.com/courses/page/2/,Python And Flask Demonstrations Practice Course - Free Online Courses with Certificates,https://courses.impodays.com/python-and-flask-demonstrations-practice-course/,https://www.udemy.com/course/python-and-flask-only-demonstration-course/?couponCode=003F5842256D3D3DE5E2,2025-05-28 18:53:15.177314
20,https://courses.impodays.com/courses/page/2/,Agile & Scrum Project Management: A Real-World Approach - Free Online Courses with Certificates,https://courses.impodays.com/agile-scrum-project-management-a-real-world-approach/,https://www.udemy.com/course/agile-scrum-project-management-udemy/?couponCode=41FBAKORSH-223MAY5,2025-05-28 18:53:16.979744
21,https://courses.impodays.com/courses/page/2/,Learn AutoCAD 2D & 3D : From Zero to Hero - Free Online Courses with Certificates,https://courses.impodays.com/learn-autocad-2d/,https://www.udemy.com/course/learn-autocad-2d/?couponCode=MAYMONTHCOUPONS,2025-05-28 18:53:18.706276
22,https://courses.impodays.com/courses/page/2/,Quantity Surveying & Building Estimate - Free Online Courses with Certificates,https://courses.impodays.com/quantity-surveying-building-estimate/,https://www.udemy.com/course/quantity-surveying-building-estimate/?couponCode=MAYMONTHCOUPONS,2025-05-28 18:53:20.493230
23,https://courses.impodays.com/courses/page/2/,"Master the Blender for Game Art, Film & Design - Free Online Courses with Certificates",https://courses.impodays.com/master-the-blender-for-game-art-film-design/,https://www.udemy.com/course/master-the-blender-for-game-art-film-design/?couponCode=96CBF4CC942221FFA986,2025-05-28 18:53:22.278603
24,https://courses.impodays.com/courses/page/2/,AI (Artificial Intelligence) for Operational Excellence - Free Online Courses with Certificates,https://courses.impodays.com/ai-artificial-intelligence-for-operational-excellence/,https://www.udemy.com/course/ai-artificial-intelligence-for-operational-excellence/?couponCode=15843C399BF477715305,2025-05-28 18:53:23.976679
25,https://courses.impodays.com/courses/page/2/,Professional Certificate in Project Management - Free Online Courses with Certificates,https://courses.impodays.com/professional-certificate-in-project-management/,https://www.udemy.com/course/professional-certificate-in-project-management/?couponCode=7C0E5047AC5DB2745917,2025-05-28 18:53:25.768065
26,https://courses.impodays.com/courses/page/2/,"Mastering Innovation Competitions, Hackathon & Crowdsourcing - Free Online Courses with Certificates",https://courses.impodays.com/mastering-innovation-competitions-hackathon-crowdsourcing/,https://www.udemy.com/course/mastering-innovation-competitions-hackathon-crowdsourcing/?couponCode=1057EDCC0EFD8F50AC38,2025-05-28 18:53:27.513318
27,https://courses.impodays.com/courses/page/2/,How to Generate Marketing Leads with AI - Free Online Courses with Certificates,https://courses.impodays.com/how-to-generate-marketing-leads-with-ai/,https://www.udemy.com/course/generate-marketing-leads-with-ai/?couponCode=28MAY2025,2025-05-28 18:53:28.834190
28,https://courses.impodays.com/courses/page/2/,AI-Driven Market Analysis & Prediction - Free Online Courses with Certificates,https://courses.impodays.com/ai-driven-market-analysis-prediction-3/,https://www.udemy.com/course/ai-driven-market-analysis-prediction-av/?couponCode=28MAY2025,2025-05-28 18:53:30.620012
29,https://courses.impodays.com/courses/page/2/,80 Days of GenAI Mastery: Elevate Your Work & Life with AI - Free Online Courses with Certificates,https://courses.impodays.com/30-days-of-genai-mastery-elevate-your-work-life-with-ai/,https://www.udemy.com/course/30-days-of-genai-mastery-elevate-your-work-life-with-ai/?couponCode=28MAY2025,2025-05-28 18:53:32.497628
30,https://courses.impodays.com/courses/page/2/,The Complete SAP Analytics Cloud Course 2025 - Free Online Courses with Certificates,https://courses.impodays.com/the-complete-sap-analytics-cloud-course/,https://www.udemy.com/course/sap-analytics-cloud-sac/?couponCode=41B1986F1B4299BF3050,2025-05-28 18:53:34.410310
31,https://courses.impodays.com/courses/page/2/,SAP BusinessObjects Essential Training 2025 - Free Online Courses with Certificates,https://courses.impodays.com/sap-businessobjects-essential-training/,https://www.udemy.com/course/sap-bi-bo/?couponCode=C930EF6818B7099A67C7,2025-05-28 18:53:36.136131
32,https://courses.impodays.com/courses/page/3/,PHP CodeIgniter 4 for Beginners: Build Full Blog System - Free Online Courses with Certificates,https://courses.impodays.com/php-codeigniter-4-for-beginners-2024-build-full-blog-system/,https://www.udemy.com/course/php-codeigniter-4-for-beginners-2023-build-full-blog-system/?couponCode=CIBLOG68,2025-05-28 18:53:39.389683
33,https://courses.impodays.com/courses/page/3/,"Master Java, Python, C & C++: All-in-One Programming Course - Free Online Courses with Certificates",https://courses.impodays.com/master-java-python-c-c-all-in-one-programming-course/,https://www.udemy.com/course/master-java-python-c-c-all-in-one-programming-course/?couponCode=69B040254A77B30608DC,2025-05-28 18:53:41.218829
34,https://courses.impodays.com/courses/page/3/,2025 Complete Python Bootcamp from Zero to Hero in Python - Free Online Courses with Certificates,https://courses.impodays.com/2023-complete-python-bootcamp-from-zero-to-hero-in-python/,https://www.udemy.com/course/python-programming-for-beginners-m/?couponCode=D42C5594EB2AEF8F0FA2,2025-05-28 18:53:42.946532
35,https://courses.impodays.com/courses/page/3/,Professional Certificate in Regulatory Compliance - Free Online Courses with Certificates,https://courses.impodays.com/professional-certificate-in-regulatory-compliance/,https://www.udemy.com/course/professional-certificate-in-regulatory-compliance-in-finance/?couponCode=88E33059F2D89C6E002E,2025-05-28 18:53:44.631739
36,https://courses.impodays.com/courses/page/3/,The Complete Matlab Course for Wireless Comm. Engineering - Free Online Courses with Certificates,https://courses.impodays.com/the-complete-matlab-course-for-wireless-comm-engineering/,https://www.udemy.com/course/the-complete-matlab-course-for-wireless-comm-engineering/?couponCode=5903AADBD658A4989847,2025-05-28 18:53:46.424098
37,https://courses.impodays.com/courses/page/3/,"Gen Z HR Mastery: Hire, Engage, Retain Zoomers Generation - Free Online Courses with Certificates",https://courses.impodays.com/gen-z-hr-mastery-hire-engage-retain-zoomers-generation/,https://www.udemy.com/course/gen-z-hr-mastery-hire-engage-retain-zoomers-generation/?couponCode=MAY04_6599125&rand=453038479,2025-05-28 18:53:48.180545
38,https://courses.impodays.com/courses/page/3/,Currency Management for Small Businesses & Corporates - Free Online Courses with Certificates,https://courses.impodays.com/currency-management-for-small-businesses-corporates/,https://www.udemy.com/course/currency-management-for-small-businesses-corporates/?couponCode=LASTWEEKMAY&referallCode=160451,2025-05-28 18:53:49.951391
39,https://courses.impodays.com/courses/page/3/,Financial Services - Overview of Retail Banking - Free Online Courses with Certificates,https://courses.impodays.com/financial-services-overview-of-retail-banking/,https://www.udemy.com/course/financial-services-overview-of-retail-banking/?couponCode=LASTWEEKMAY&referallCode=943511,2025-05-28 18:53:51.651014
40,https://courses.impodays.com/courses/page/3/,Applying Covey's 7 Habits for Holistic Growth - Free Online Courses with Certificates,https://courses.impodays.com/applying-coveys-7-habits-for-holistic-growth/,https://www.udemy.com/course/applying-coveys-7-habits-for-holistic-growth/?couponCode=933C38BA07DE3BEE2A9A,2025-05-28 18:53:53.489787
